{
  "id": "starlink-lifecycle",
  "title": "Starlink 一顆衛星的一生：發射・抬軌・運營・離軌",
  "subtitle": "用半長軸曲線讀懂低軌星系的生命週期 — 三顆處於不同階段的衛星",
  "hero_note": "同一套 TLE 資料、同一張 SMA 圓形時間圖：抬軌中的 STARLINK-37457（2026-08-11 發射，停滯兩週後已恢復爬升）、運營中的 STARLINK-3005（2021 年發射、563 km 站位保持）、離軌中的 STARLINK-4442（30 天下降 101 km、目前約 194 km）。星系統計為即時查詢（見 ⑦/⑦.5/⑦.8 三個即時子頁面），本節代表衛星範例為 2026-09-28 覆核更新：原離軌代表 STARLINK-4412 與備選兩顆已分別於 09-04～09-07 完成再入（Space-Track 目錄登錄），改列為「已再入」實例並換上新的離軌代表星。",
  "updated": "2026-09-28",
  "sections": [
    {
      "type": "text",
      "title": "導言：一條曲線講完一生",
      "dur": 4,
      "body": "Starlink 衛星的一生約 5 年：火箭把它放到 300 km 上下的停泊軌道，氬離子推進器花 1～3 個月把半長軸抬到 480～570 km 的工作殼層；接著是數年的站位保持（每月半長軸變化不到 1 km）；壽命末期主動降軌，最後數百公里由大氣阻力接手，數週內再入燒毀。這三個階段在 TLE 的半長軸（SMA）時序上是三種完全不同的形狀——上升斜坡、水平直線、加速下墜。本故事以本系統 /orbit 逐日軌道要素圖，各挑一顆正處於該階段的衛星。"
    },
    {
      "type": "positions",
      "title": "① 星系全貌：殼層與軌道面（3D）",
      "dur": 7,
      "mode": "group",
      "val": "starlink",
      "globe": true,
      "body": "目錄中全部 Starlink 的 TLE 傳播位置（近即時；約 1.1 萬顆，含抬軌中與離軌中者）。以實際高度比例呈現可清楚看到 53°／43°／70° 等傾角族群的軌道面，以及貼近地表、高度較低的抬軌與離軌個體。"
    },
    {
      "type": "groupstats",
      "title": "② 星系儀表板：高度／傾角分佈與歷年發射累積",
      "dur": 6,
      "group": "starlink",
      "body": "高度直方圖的主峰在 400～520 km（約 9,460 顆穩定站位，集中於 460～500 km）與 560～580 km（約 340 顆，2021 年前後的 v1.0/v1.5 殼層，隨舊世代退役持續減少）；400 km 以下約 910 顆，多為抬軌中新星與離軌中舊星的混合（2026-09-28 盤點，共 10,944 顆）。發射年份長條反映 2022 年後的加速部署。"
    },
    {
      "type": "table",
      "title": "③ 生命週期四階段（本故事代表星）",
      "dur": 6,
      "columns": [
        "階段",
        "典型高度",
        "SMA 變化率",
        "歷時",
        "代表衛星",
        "NORAD",
        "發射日"
      ],
      "rows": [
        [
          "發射／停泊",
          "280～350 km",
          "—",
          "數天",
          "（同批 2026-08-11 發射 29 顆）",
          "100272–100300",
          "2026-08-11"
        ],
        [
          "抬軌（電推進）",
          "350 → 480～570 km",
          "+3～+6 km/日",
          "1～3 個月",
          "STARLINK-37457",
          "100294",
          "2026-08-11"
        ],
        [
          "運營（站位保持）",
          "480～570 km",
          "|Δa| < 1 km/月",
          "約 5 年",
          "STARLINK-3005",
          "48881",
          "2021-06-30"
        ],
        [
          "離軌（主動降軌 + 阻力）",
          "570 → < 200 km",
          "−2 → −10 km/日（加速）",
          "數月，末段數週",
          "STARLINK-4442",
          "53480",
          "2022-08-12"
        ]
      ],
      "note": "高度／變化率為本系統 TLE 統計之典型值，非官方規格；離軌代表衛星請以 ⑦ 即時離軌名單為準，本表範例可能隨衛星再入而需更換（2026-09-28 覆核；原代表 STARLINK-4412 已於 09-06 再入）。NORAD ≥ 100000 之新星以 Alpha-5 六位數編目，本系統全鏈支援。"
    },
    {
      "type": "sat",
      "anchor": "raising",
      "title": "④ 抬軌中：STARLINK-37457（NORAD 100294，2026-08-11 發射，2026-09-28 覆核）",
      "dur": 14,
      "norads": [
        100294,
        100293,
        100298
      ],
      "row": true,
      "autoplay": true,
      "height": 720,
      "start": "2026-08-11",
      "body": "發射後一週開始有 TLE，半長軸自約 6,660 km（高度 ~285 km）以每日數公里的斜率爬升，前 15 天內已抬升約 60 km 至約 344 km；2026-08-26 起連續約兩週高度停滯於約 343～344 km，同批的 100293（停滯於約 344 km）與 100298（停滯於約 331 km）呈現相同樣貌。停滯在 9 月中結束：100298 於 09-11、100294 於 09-12、100293 於 09-18 前後恢復爬升，截至 09-27 三顆皆已抬升至約 460 km，正朝 480～570 km 工作殼層前進——這段「爬升、暫停、再爬升」的階梯形狀，是分批抬軌作業節奏在 TLE 上的樣貌。同批另有 100273 於 09-11、約 347 km 處後即無新 TLE，本系統無法由 TLE 判斷原因（可能失去追蹤或任務異常）。Spiral Polar 圖上 RAAN 隨時間規律漂移、傾角維持 53° 不變。可切換同批的 100293、100298 比較。"
    },
    {
      "type": "sat",
      "anchor": "operating",
      "title": "⑤ 運營中：STARLINK-3005（NORAD 48881，2021-06-30 發射）",
      "dur": 12,
      "norads": [
        48881,
        49161
      ],
      "row": true,
      "autoplay": true,
      "height": 720,
      "start": "2026-03-31",
      "body": "服役第 6 年，高度 563 km，近 30 天半長軸淨變化不到 0.01 km（期間擺幅約 0.17 km）——SMA 圓形圖幾乎是一個完美的圓，偶爾的微小鋸齒就是站位保持點火（本系統機動偵測的 Δa 門檻 0.5 km 正是為了與這類微幅修正區隔）。對照 49161（STARLINK-3080，572 km 殼層）可看出不同殼層的站位高度差。"
    },
    {
      "type": "sat",
      "anchor": "deorbit",
      "title": "⑥ 離軌與再入：STARLINK-4412 已於 09-06 再入，接棒觀察 STARLINK-4442（NORAD 53480，2026-09-28 覆核）",
      "dur": 14,
      "norads": [
        53480,
        53477,
        47818,
        46159
      ],
      "row": true,
      "autoplay": true,
      "height": 720,
      "start": "2026-06-11",
      "body": "服役僅 4 年即進入離軌程序：先以推進器主動降軌，離開工作殼層後大氣阻力隨高度下降而指數增強。上一版範例 STARLINK-4412（53477，2022-08-12 發射）最後一筆 TLE 為 09-06、高度約 145 km，Space-Track 目錄登錄當日再入；備選 47818（STARLINK-2401）與 46159（STARLINK-1595）亦分別於 09-07、09-04 再入——三顆的 SMA 圓形圖都停在螺旋向內收斂的終點，這就是「一生的終點」。接棒的同批衛星 STARLINK-4442（53480，同為 2022-08-12 發射）近 30 天半長軸下降約 101 km、近 7 天下降約 45 km，目前高度約 194 km，預計一至兩週內再入。若本頁載入時該星已無新 TLE，即代表已再入——即時、免人工維護的完整名單見 ⑦「正在離軌的 Starlink」。"
    },
    {
      "type": "embed",
      "title": "⑦ 正在離軌的 Starlink（即時）",
      "dur": 7,
      "url": "/starlink?tab=deorbit",
      "height": 720,
      "body": "改為即時網頁，不再是固定時間點的快照：每次開啟都重新查詢「近 5 天仍有 TLE、近 30 天半長軸下降逾 40 km、高度低於 480 km」的離軌候選名單，並可逐顆展開看 SGP4 逐圈外推的再入時刻與落點粗估。"
    },
    {
      "type": "embed",
      "title": "⑦.5 Starlink 顆數普查：跟外部數字對得起來嗎",
      "dur": 6,
      "url": "/starlink?tab=census",
      "height": 760,
      "body": "「Starlink 到底有幾顆」這個看似簡單的問題，答案取決於統計口徑：本頁即時抓取 keeptrack.space 公開的在軌／運作中／累計發射三個數字，跟本系統依不同新鮮度篩選算出的數字並列比對，說明差異從何而來——這正是離軌名單為何需要「近期仍有 TLE」這個條件的原因。"
    },
    {
      "type": "table",
      "title": "⑦.7 世代規格比較：V1.0 → V3.0",
      "dur": 8,
      "columns": [
        "項目",
        "V1.0（2019）",
        "V1.5（2021）",
        "V2.0 mini（2023–）",
        "V3.0（2025–）"
      ],
      "rows": [
        [
          "首發年份",
          "2019",
          "2021",
          "2023",
          "2025"
        ],
        [
          "衛星質量",
          "≈260 kg",
          "≈280 kg",
          "≈800 kg",
          "≈1,250–2,000 kg（不同來源）"
        ],
        [
          "構型",
          "平板、單面太陽能板",
          "平板、增雷射模組",
          "模組化、天線陣列擴大",
          "大型模組化、高功率設計"
        ],
        [
          "軌道高度",
          "~550 km",
          "~550 km",
          "530–570 km",
          "~500 km（部分資料稱 350–500 km 區間優化）"
        ],
        [
          "軌道傾角",
          "53°",
          "53°、70°、97.6°",
          "53°、70°、97.6°",
          "53°、70°、97.6°"
        ],
        [
          "下行容量（單星）",
          "數 Gbit/s 級",
          "數 Gbit/s 級",
          "~100 Gbit/s",
          "1 Tbit/s（部分媒體稱 1,000 Gbps）"
        ],
        [
          "上行容量（單星）",
          "—",
          "—",
          "~7 Gbit/s",
          "160–200 Gbit/s"
        ],
        [
          "星間鏈路",
          "無",
          "有（速率較低）",
          "高速雷射鏈路標配",
          "高速雷射鏈路，背靠背總容量達 ~4 Tbit/s"
        ],
        [
          "通信頻段",
          "Ku/Ka",
          "Ku/Ka + 雷射",
          "Ku/Ka/E + 雷射",
          "Ku/Ka/E + 雷射（含星地雷射饋電）"
        ],
        [
          "推進系統",
          "霍爾推力器（氪）",
          "霍爾推力器（氪）",
          "高功率霍爾（氬）",
          "高功率霍爾（氬），推力與比沖再提升"
        ],
        [
          "發射載具",
          "Falcon 9",
          "Falcon 9",
          "Falcon 9",
          "Starship（星艦）"
        ],
        [
          "單次發射數量",
          "60 顆",
          "53 顆",
          "21 顆",
          "約 54 顆（Starship 任務）"
        ],
        [
          "設計壽命",
          "5–7 年",
          "5–7 年",
          "5–7 年",
          "7–10 年（預估）"
        ],
        [
          "終端目標速率",
          "~100 Mbit/s",
          "~150 Mbit/s",
          "~500 Mbit/s",
          "~1 Gbit/s"
        ],
        [
          "除役現況（2026）",
          "大規模受控脫軌中：2025/12–2026/5 半年度報告確認 176 顆已再入，多數已退役，仍有少量在軌或排程中",
          "開始排程退役：部分因電池／遙測劣化或達 5 年壽命而安排脫軌",
          "現役主力",
          "現役主力（新部署）"
        ]
      ],
      "note": "本表整理自公開報導與 SpaceX 發布資料，非本系統資料庫觀測值，不同來源數字略有出入（如單星質量、下行容量）僅供參考，非官方逐版正式規格書。V1.0／V1.5 除役為近期公開報告揭露之整體趨勢，並非逐顆比對本系統目錄後的統計——若想即時查看本系統目錄中某世代目前仍有追蹤的顆數，可至 ⑧「對台灣的意義」頁用世代篩選切至 v1.0 或 v1.5，統計卡「資料庫衛星數」即為該世代現存顆數（依發射日期啟發式分類，見 ⑦.8 V3 篩選方法說明）；目前正在離軌（含任一世代）之即時名單見 ⑦。"
    },
    {
      "type": "embed",
      "title": "⑦.8 Starlink V3 佈署數量統計",
      "dur": 5,
      "url": "/starlink?tab=v3",
      "height": 700,
      "body": "追蹤下一代 Starlink V3 營運衛星的部署進度：由於公開目錄不含硬體世代標記，本頁以已知的部署時程與初始入軌殼層做間接推測（啟發式、非官方分類），在正式部署開始前會如實顯示 0 顆。"
    },
    {
      "type": "embed",
      "title": "⑧ 對台灣的意義：Starlink 幾何可用性與延遲",
      "dur": 8,
      "url": "/starlink",
      "height": 900,
      "body": "一顆衛星的一生最終要回到服務：本系統的 Starlink 台灣服務能力分析，以即時 TLE 計算台北（可改座標／遮蔽仰角）上空可見衛星數時間軸、RTT 下限與天空密度。運營中的衛星數量、殼層分佈與退役節奏，直接決定這張圖的高低起伏。"
    },
    {
      "type": "text",
      "title": "結語",
      "dur": 3,
      "body": "三條曲線、三種形狀：上升斜坡、水平直線、向內螺旋。從 TLE 半長軸就能不靠任何內部資料判讀一顆衛星處於生命週期的哪個階段；把同樣的判讀套到整個星系，就得到「每年有多少顆在抬軌、多少顆在退役」的星系新陳代謝率——這也是本系統機動偵測（Δa 門檻、da_monotonic_decay 阻力排除旗標）所依據的物理直覺。"
    }
  ]
}
