{
  "id": "sea-land-space-sky",
  "title": "「海、地、星、空」——打造不中斷的未來通訊網路",
  "subtitle": "海纜有斷纜監測、地面網路有網管中心——那「星」這一層的風險，誰在守望？",
  "hero_note": "本篇以「海、地、星、空」多元通訊網路的韌性視角，先以台灣周邊海纜互動地圖與斷纜事件蒐整呈現『海』層風險，再展示本系統可為『星』層提供的四種守望能力：① 通訊衛星星系全景與健康儀表板 ② 衛星異常行為（機動候選）偵測 ③ 接近事件篩選與風險排序 ④ 災時備援的台灣地面站連線視窗。全部以最新可取得之公開 TLE（Space-Track GP）近即時 SGP4/SDP4 傳播；結果屬公開資料與簡化模型之技術展示，不代表精密星曆、已確認機動或操作級碰撞機率，不宜作為營運決策依據。",
  "updated": "2026-09-07",
  "sections": [
    {
      "type": "toc",
      "title": "章節總覽",
      "anchor": "toc",
      "dur": 4,
      "body": "現代通訊網路由海纜（海）、地面網路（地）與多軌道衛星（星、空）疊合而成。前兩層各有成熟的監測體系；本篇聚焦最少被看照的『星』層——四個子題各自獨立，點磚直達。",
      "items": [
        {
          "icon": "🌐",
          "label": "① 星層韌性缺口",
          "anchor": "part1",
          "sub": "三層風險與守望現況＋台灣周邊海纜互動地圖與斷纜事件蒐整"
        },
        {
          "icon": "🛰️",
          "label": "② 通訊衛星全景",
          "anchor": "part2",
          "sub": "GEO 自有衛星 ST-2・低軌 OneWeb・Starlink 與大陸通訊星系對照"
        },
        {
          "icon": "📈",
          "label": "③ 異常行為預警",
          "anchor": "part3",
          "sub": "通訊星系 2026 年機動候選事件：衛星的『健康心跳』"
        },
        {
          "icon": "⚠️",
          "label": "④ 接近風險排序",
          "anchor": "part4",
          "sub": "幾何接近篩選與 Pc proxy——在服務中斷之前看到風險"
        },
        {
          "icon": "📡",
          "label": "⑤ 災時備援連線",
          "anchor": "part5",
          "sub": "地面網路中斷時，衛星備援的連線視窗在哪裡、有多長"
        }
      ]
    },
    {
      "type": "text",
      "anchor": "part1",
      "title": "第一部：星層的韌性缺口",
      "dur": 3,
      "body": "海纜斷了，有斷纜偵測與修復船隊；基地台倒了，有網管中心（NOC）即時告警。但當災害讓海纜與地面網路同時失效，衛星就是最後的通訊生命線——而衛星本身同樣暴露於風險之中：低軌碎片環境逐年惡化帶來碰撞風險、同步軌道上曾多次觀測到衛星被長期抵近、大氣阻力持續消耗軌道壽命。這一層的風險守望，目前多仰賴國外資訊來源，延遲、無法客製，戰災時亦未必可靠。本篇展示：僅用公開軌道資料，就能為『星』層建立一套本土的風險守望能力。"
    },
    {
      "type": "table",
      "title": "海、地、星、空——三層網路的風險與守望現況",
      "anchor": "layer-table",
      "dur": 6,
      "columns": ["層面", "通訊角色", "主要風險", "既有守望機制", "本篇對應能力"],
      "rows": [
        ["海｜國際海纜", "跨國骨幹頻寬", "斷纜、錨害、海底地質災害", "纜線監測系統、海纜修復船隊", "海纜互動地圖＋斷纜事件蒐整（下兩頁）"],
        ["地｜行動與固網", "日常語音／數據／寬頻", "天災毀損、斷電、壅塞", "NOC 網管中心、備援路由", "—（非本篇範圍）"],
        ["星、空｜多軌道衛星", "偏鄉離島覆蓋、災時備援", "碰撞、異常抵近、軌道衰減", "多仰賴國外資訊，缺乏本土獨立監測", "② 全景儀表板 ③ 異常預警 ④ 接近排序 ⑤ 連線視窗"]
      ],
      "row_anchors": ["cable-map", "", "part2"],
      "note": "地層之守望機制為公開常識性描述；本系統能力集中於『星、空』層，海層以下兩頁之態勢蒐整補齊背景。點選第一列直達海纜地圖、第三列直達星層展示。"
    },
    {
      "type": "embed",
      "title": "全球海纜態勢——互動地圖（台灣視角）",
      "url": "/cable",
      "height": 860,
      "dur": 8,
      "anchor": "cable-map",
      "body": "以 Cesium Ion 影像為底圖的 3D 地球，載入 TeleGeography 公開圖資之全球 728 條海纜系統，其中 11 條登陸或行經台灣（含台澎金馬、台馬四號等國內幹線）以藍色高亮。點選纜線或左側清單看系統說明與事件紀錄；點紅色 ⚠ 標記看斷纜事件；右上圖層開關可切換全球／僅台灣相關／事件／全球登陸點。視角可自由縮放平移至全球任一海域。",
      "note": "海纜圖資 © TeleGeography submarinecablemap.com（CC BY-NC-SA 3.0，2026-09-07 擷取），路線為示意級、非實際海圖座標；已除役系統（如 SeaMeWe-3）與較舊國內纜（台馬二、三號）不在圖資內。"
    },
    {
      "type": "table",
      "title": "斷纜事件蒐整——當「海」層被切斷時發生了什麼",
      "anchor": "cable-incidents",
      "dur": 8,
      "columns": ["時間", "海纜", "事件摘要", "後續與應處", "原始新聞"],
      "rows": [
        ["2023-02-02／02-08", "台馬二號、台馬三號", "一週內接連遭中國漁船與貨輪拖斷，馬祖對外通訊中斷約 50 天", "以微波備援維持基本連線；催生離島衛星備援與海纜保護修法討論", "[關鍵評論網](https://www.thenewslens.com/article/181232)、[自由評論網](https://talk.ltn.com.tw/article/breakingnews/5539632)"],
        ["2025-01-03", "TPE 跨太平洋快線（野柳東北海域）", "疑遭喀麥隆籍權宜輪「順興39」拖錨損壞", "流量由其他國際纜繞送；海巡強化可疑船舶監控", "[國防院分析](https://indsr.org.tw/focus?pid=2762&typeid=26&uid=11)、[公視專題](https://news.pts.org.tw/curation/135)"],
        ["2025-02-25", "台澎三號", "多哥籍權宜輪「宏泰58」（中資背景、船員均中國籍）拖斷，海巡登檢扣船", "船長 2025-06 遭判刑 3 年，為台灣首例斷纜刑事定罪；2025-12 兩岸就歸因持續攻防", "[公視新聞](https://news.pts.org.tw/article/787318)、[中央社](https://www.cna.com.tw/news/acn/202512240218.aspx)"],
        ["2025 全年", "各海纜合計", "共 17 件斷線或部分斷線（含老化故障與外力）", "多數由備援路由吸收，未致全面中斷", "[天下雜誌](https://www.cw.com.tw/article/5136369)、[公視查核](https://news.pts.org.tw/article/768583)"],
        ["2026 年 1–3 月", "各海纜合計", "已發生 6 次斷裂", "「海纜七法」修法初審通過，強化海纜保護與罰則", "[天下雜誌](https://www.cw.com.tw/article/5136369)、[房感整理](https://www.housefeel.com.tw/article/%E6%B5%B7%E5%BA%95%E9%9B%BB%E7%BA%9C-%E6%B5%B7%E5%BA%95%E9%9B%BB%E7%BA%9C%E5%8F%B0%E7%81%A3-%E6%B5%B7%E5%BA%95%E9%9B%BB%E7%BA%9C%E6%96%B7%E8%A3%82/)"],
        ["全球脈絡", "—", "全球每年平均逾 150 件斷纜；台灣周邊近 3 年平均約 7–8 件／年", "波羅的海 2024–25 連環事件使「灰色地帶海纜破壞」成為國際議題", "[台灣事實查核中心](https://tfc-taiwan.org.tw/submarine-cable-risks-taiwan-prevent-internet-isolation/)、[報導者](https://www.twreporter.org/a/mini-reporter-undersea-cables)"]
      ],
      "note": "「原始新聞」欄為公開報導連結（檢索日 2026-09-07），點選開新視窗。事件歸因以司法認定為準，未定案者以「疑似」表述；統計數字為媒體引述之官方口徑。海纜修復需調度專業海纜船、常以週至月計——這正是第五部「災時衛星備援」存在的理由。"
    },
    {
      "type": "text",
      "anchor": "part2",
      "title": "第二部：通訊衛星全景——台灣用得到的三種軌道",
      "dur": 3,
      "body": "本部完成後，讀者應能分辨三種軌道通訊資源的樣貌：同步軌道（GEO）自有衛星 ST-2、極軌 1,200 km 的低軌星系 OneWeb（台灣電信業者引進之低軌衛星服務所用星系），以及作為對照的 Starlink 巨型星座與大陸通訊星系。3D 圖依軌道域配色：LEO 青、MEO 綠、GEO／IGSO 琥珀。TLE 傳播位置為態勢展示等級，非精密定軌。"
    },
    {
      "type": "positions",
      "title": "OneWeb — 低軌通訊備援星系（TLE 傳播軌道位置）",
      "mode": "group",
      "val": "oneweb",
      "globe": true,
      "dur": 6,
      "body": "極軌約 1,200 km、傾角 87.9°，以極軌面提供含高緯度在內的全球覆蓋——災時地面網路中斷情境下，台灣可用的低軌備援選項。",
      "anchor": "pos-oneweb"
    },
    {
      "type": "groupstats",
      "group": "oneweb",
      "title": "OneWeb — 星系健康儀表板",
      "dur": 5,
      "anchor": "stats-oneweb",
      "body": "數量、軌道域、高度／傾角分佈與歷年發射累積——為備援星系建立可持續追蹤的基準畫像。"
    },
    {
      "type": "sat",
      "norads": [37606],
      "title": "ST-2 — 定點東經 88° 的同步軌道通訊衛星（逐日軌道歷史）",
      "dur": 8,
      "anchor": "sat-st2",
      "body": "ST-2（2011-022B）由中華電信與新加坡電信合資之衛星公司持有營運，2011 年發射，服務涵蓋固定通訊與企業專網。GEO 衛星須定期執行站位保持機動以維持軌位——逐日軌道歷史中的週期性微小變化，就是這顆衛星的『健康心跳』：心跳規律代表營運正常，心跳異常（長期未機動、或非例行的大幅變化）則值得關注。此為以公開 TLE 觀察自有衛星資產健康狀態的示範。"
    },
    {
      "type": "positions",
      "title": "Starlink — 巨型星座對照（TLE 傳播軌道位置）",
      "mode": "group",
      "val": "starlink",
      "globe": true,
      "dur": 5,
      "body": "目錄中逾萬顆的多殼層巨型星座——展示低軌通訊的規模上限，同時也是低軌交通壅塞的主要來源之一：星層越擁擠，第四部的接近篩選就越重要。",
      "anchor": "pos-starlink"
    },
    {
      "type": "positions",
      "title": "大陸通訊星系 — 千帆、國網、中星、亞太、天鏈、天通（對照）",
      "mode": "group",
      "val": "prc_comm",
      "globe": true,
      "dur": 5,
      "body": "低軌巨型星座千帆與國網正快速部署，GEO 則有中星、亞太等既有系統——軌位與頻譜是有限資源，通訊衛星的國際競逐使『知道誰在哪裡、誰在動』成為韌性的基本功。",
      "anchor": "pos-prc-comm"
    },
    {
      "type": "text",
      "anchor": "part3",
      "title": "第三部：衛星異常行為預警——通訊星系的機動候選",
      "dur": 3,
      "body": "本部完成後，讀者應能看出各通訊星系『機動候選事件』的規模與月分佈，並理解候選≠確認。偵測方式：相鄰 TLE 半長軸跳變超過門檻（LEO 0.5 km、MEO/GEO 2 km、間隔 ≤5 天）之統計級掃描。對通訊營運者，這代表兩種價值：其一，追蹤自有／租用衛星是否按節奏執行例行機動（站位保持、阻力補償）——節奏中斷可能是故障前兆；其二，發現他星異常接近己方軌位時及早應處。Starlink 候選數偏高部分反映其龐大樣本與頻繁電推站位保持，跨星系比較請看「每 100 顆衛星事件率」而非總數；等效 Δv 為近圓一階估算。"
    },
    {
      "type": "maneuvers",
      "title": "通訊星系 2026 年機動候選事件：月分佈與活躍衛星",
      "groups": ["starlink", "oneweb", "prc_comm"],
      "dur": 12,
      "anchor": "maneuvers-comm"
    },
    {
      "type": "text",
      "anchor": "part4",
      "title": "第四部：接近風險排序——在服務中斷之前看到它",
      "dur": 3,
      "body": "本部完成後，讀者應能理解『距離 <10 km』是篩選門檻而非風險判定。一次衛星碰撞不只損失衛星本身，更會即刻中斷其承載的通訊服務、並讓碎片長期污染同高度的其他星系。篩選方式：單一傳播時刻之全目錄 KD-tree 距離篩選；展開 3D 後於兩星 TLE 重疊期間粗掃、再於最接近時刻聚焦細掃求最小距離。表中 Pc proxy（Chan 2-D 近似、固定假設協方差）僅供事件排序，非操作級碰撞機率——它回答的問題是『今天該優先關注哪幾對』，而非『會不會撞』。"
    },
    {
      "type": "cdm",
      "threshold_km": 10,
      "title": "幾何接近配對（<10 km，TLE 傳播）與 3D 展開",
      "dur": 10,
      "anchor": "conjunction-screen"
    },
    {
      "type": "text",
      "anchor": "part5",
      "title": "第五部：災時備援連線——衛星在哪裡、視窗有多長",
      "dur": 3,
      "body": "設想情境：強震造成海纜多處中斷、部分地面基站失效，應變單位啟動衛星備援。此刻的關鍵問題很具體——備援星系的衛星什麼時候過頂？連線視窗有多長？下一個視窗在幾分鐘後？本部以台灣地面站視角，用 TLE 預報未來 24 小時 OneWeb 衛星的過頂序列（AOS／LOS、最大仰角與航跡），把『衛星備援』從抽象概念變成可排程的連線時刻表。模型為純幾何可見性（仰角 >5°），未納入鏈路預算與終端規格，屬規劃參考而非通聯保證。"
    },
    {
      "type": "skyplot",
      "group": "oneweb",
      "title": "備援連線視窗：台灣站對 OneWeb 之未來過頂（方位／仰角天空圖）",
      "dur": 9,
      "anchor": "skyplot-oneweb",
      "body": "播放時標記沿航跡移動，模擬地面站的追蹤與連線視窗——災時通訊調度需要的正是這張時刻表。"
    },
    {
      "type": "embed",
      "title": "3D 展示（Cesium）：台北站覆蓋與過頂時間軸",
      "url": "/taipei",
      "height": 820,
      "dur": 7,
      "body": "以台北為站址的 3D 覆蓋與過頂時間軸——地面站視角的追蹤／連線示範（本系統既有獨立示範頁）。",
      "anchor": "taipei-embed"
    },
    {
      "type": "text",
      "title": "結語：為「星」層補上守望，通訊才真正不中斷",
      "anchor": "closing",
      "dur": 2,
      "body": "海纜與地面網路的韌性已有成熟體系；本篇展示的是缺口所在的『星、空』層——星系全景與健康儀表板、異常行為預警、接近風險排序、災時連線視窗，四種能力共用同一份公開 TLE 與同一套傳播／偵測引擎，全程不依賴國外加值服務。\n提醒仍然適用：近即時，不是即時；候選，不是確認；幾何接近，不是碰撞風險；可見性，不是通聯保證；Pc proxy 僅供排序，不是操作級碰撞機率。本篇屬技術展示，期待與通訊營運、災防應變領域的實務需求對接，把守望做成服務。"
    }
  ]
}
