{
  "id": "diting-rf-sensing-constellation",
  "title": "從「看地球」到「聽地球」：商用射頻感知星座「諦聽」首發查核",
  "subtitle": "三星編隊 TDOA／FDOA 定位原理、與光學／SAR 遙感的本質差異，以及它跟本專案 TLE 機動偵測工作的界線",
  "hero_note": "本篇為公開情資背景整理，非本系統之獨立觀測或運算結果。任務事實整理自長光衛星／吉林一號公眾號原始公告（經新浪財經轉載）、泰伯網、財聯社三則公開報導（詳見末節「⑥ 資料來源」），本系統未獨立查證其中定位精度、頻段覆蓋等技術指標是否屬實——原始報導本身亦未揭露這些數字。標示準則：[公開報導]＝媒體轉述並附原始網址、[通用技術原理]＝該類系統之公開技術路徑一般性說明、[誠實界定]＝本系統對自身能力範圍的聲明。本篇不涉及本專案自有之 TLE／SSA 資料，亦不對任一方之技術能力或意圖做出判斷。",
  "updated": "2026-09-30",
  "sections": [
    {
      "type": "text",
      "title": "導言：射頻感知，一種不同於「看」的偵察維度",
      "dur": 5,
      "anchor": "intro",
      "body": "2026 年 9 月 20 日，中國商業火箭「力箭一號遙十八」以一箭九星方式發射，其中三顆「諦聽 01 組 A／B／C」衛星，據公開報導稱為中國首個以三星編隊方式開展商用天基射頻數據採集的衛星星座。光學衛星回答的是「那裡有什麼」，射頻感知衛星回答的則是「那裡正在發射什麼訊號」——這是情報維度上的差異，而非單純的解析度或精度比較。本篇整理公開報導所述之任務事實與技術原理，並清楚標明本系統未能查證的部分，以及此案例與本專案自身工作範圍的界線。"
    },
    {
      "type": "table",
      "title": "① 發射與星座基本事實 [公開報導]",
      "dur": 8,
      "anchor": "facts",
      "columns": [
        "項目",
        "內容"
      ],
      "rows": [
        [
          "發射時間",
          "2026-09-20 12:03（北京時間）"
        ],
        [
          "發射地點",
          "東風商業航天創新試驗區"
        ],
        [
          "運載火箭",
          "力箭一號遙十八（中科宇航研製，第 16 次飛行，累計已送入 121 顆衛星）"
        ],
        [
          "發射方式",
          "一箭九星"
        ],
        [
          "核心酬載",
          "諦聽 01 組 A／B／C 星（三星編隊）"
        ],
        [
          "同箭其他衛星",
          "秦嶺衛星 01／02 星、浦江四號、鵬城首發星、超智算一號、雲霄探路者等"
        ],
        [
          "星座抓總設計與運營",
          "天津星瞰九州科技有限公司（成立於 2023 年）"
        ],
        [
          "衛星研製",
          "長光衛星"
        ],
        [
          "星座首期規劃",
          "據報導規劃 2029 年前建置 60 顆低軌小衛星，目前為技術試驗驗證的早期階段"
        ],
        [
          "最新融資",
          "據報導 2026 年 8 月完成新一輪（Pre-A+ 輪）融資"
        ],
        [
          "尚未公開之技術指標",
          "頻段覆蓋範圍、定位精度、重訪時間、數據更新頻率——截至本篇更新日期均未見官方公開數字"
        ]
      ],
      "note": "本表整理自長光衛星／吉林一號公眾號原始公告（經新浪財經轉載）、泰伯網、財聯社三則公開報導（原文與網址見末節「⑥ 資料來源」），本系統未獨立查證，請以原始報導來源為準。"
    },
    {
      "type": "table",
      "title": "② 射頻感知 vs 光學／SAR：回答的是不同的問題",
      "dur": 8,
      "anchor": "comparison",
      "columns": [
        "維度",
        "光學遙感",
        "合成孔徑雷達（SAR）",
        "射頻感知（諦聽類系統）"
      ],
      "rows": [
        [
          "感測物理量",
          "反射之可見光／紅外光",
          "主動發射微波、接收地表後向散射",
          "地面發射源之被動電磁輻射"
        ],
        [
          "回答的問題",
          "那裡有什麼、外形如何",
          "地表結構／形變如何",
          "誰在發射、什麼頻段、從哪裡發射"
        ],
        [
          "全天候能力",
          "否（受雲層與光照限制）",
          "是",
          "是（電磁波可穿透雲雨）"
        ],
        [
          "典型商業產品",
          "正射影像、分類圖、變化偵測圖",
          "地表形變圖、船舶偵測",
          "發射源座標、頻譜事件清單、訊號分類報告"
        ]
      ],
      "note": "一艘船可以關閉 AIS，雲層也可能使光學衛星無法取得清晰畫面；但只要船上的雷達或通信設備仍在運作，就可能持續釋放電磁訊號。射頻感知鎖定的正是「設備仍在工作」的痕跡，而非外形本身。"
    },
    {
      "type": "text",
      "title": "③ 三星編隊如何定位：TDOA／FDOA 多邊定位原理 [通用技術原理]",
      "dur": 10,
      "anchor": "principle",
      "body": "單顆衛星只能判斷「某片區域出現了訊號」，無法精確定位發射源；若三顆衛星以受控幾何隊形同時接收同一訊號，則可比對訊號到達各星的細微差異來解算位置，相當於把地面無線電測向站搬上太空、且不受國界與地形限制。國際同類商用系統（如美商 HawkEye 360）公開採用的技術路徑可作為理解框架：TDOA（到達時差）——訊號到達三顆衛星的時間存在微小差異，任兩星的時間差對應一條雙曲線，兩條雙曲線之交點即為發射源的概略位置；FDOA（到達頻差／都卜勒頻差）——衛星以每秒約 7 公里以上相對地面運動，對同一發射源觀測到的都卜勒頻移不同，提供第二組獨立約束以協助解析定位模糊度。兩者聯合解算可得出發射源座標，精度則取決於訊號時長、頻寬、訊噪比與衛星幾何構型（GDOP）等因素。誠實註記：截至本篇更新日期，官方尚未公開「諦聽」的具體定位精度；以上原理僅為此類三星編隊系統的通用技術描述，並非對「諦聽」實際性能之證實。"
    },
    {
      "type": "text",
      "title": "④ 商業模式與產業脈絡 [公開報導]",
      "dur": 6,
      "anchor": "business",
      "body": "傳統遙感的商業產品是「影像」，射頻感知類星座的產品形態則轉為「頻譜事件清單」「發射源座標」「訊號分類報告」，多採訂閱制／API 供應，與 HawkEye 360 之商業模式相近。據公開報導，此類系統之應用場景設想包括無線電管理、海洋船舶監測、公共安全、鐵路交通與應急救援等，反映商業航天競爭正從「造更多衛星」轉向「賣更多種類的數據」。惟「諦聽 01 組」目前仍處於技術試驗驗證的早期階段，前述應用場景屬產業規劃層次之公開說法，尚待後續在軌測試與組網運行結果驗證。"
    },
    {
      "type": "text",
      "title": "⑤ 誠實界定：這跟本專案有什麼關係、沒有什麼關係 [誠實界定]",
      "dur": 6,
      "anchor": "boundary",
      "body": "本專案（機動偵測／SSA）處理的是公開 TLE 的軌道行為，與「諦聽」處理的電磁頻譜訊號是完全不同的資料維度與感測手段，兩者沒有技術上的直接交集，本專案也不具備射頻情資之採集或分析能力。收錄本篇僅為讓 SSA／SDA 的視野更完整：軌道位置（TLE／精密星曆）、軌道機動（本專案主題）、電磁頻譜活動（諦聽這類系統）是三種可互補、但彼此獨立的情報維度，實務上常需多源融合才能提高判讀信心。本篇內容整理自使用者提供之公開報導／分析文字，屬外部獨立報導，非本專案之查證或研究成果，亦與本專案在台灣所做之 TLE 機動偵測工作性質不同、互不隸屬。"
    },
    {
      "type": "table",
      "title": "⑥ 資料來源",
      "dur": 2,
      "anchor": "sources",
      "columns": [
        "來源",
        "說明"
      ],
      "rows": [
        [
          "[长光卫星参与研制！我国成功发射谛听01组A/B/C星（吉林一號公眾號，經新浪財經轉載）](https://finance.sina.com.cn/roll/2026-09-20/doc-inismzva9365462.shtml)",
          "第一手來源：由衛星研製方長光衛星之官方公眾號發布，明確指出諦聽 01 組 A／B／C 星由天津星瞰九州科技有限公司抓總、長光衛星研製，為中國首次以三星編隊開展商業天基射頻數據採集之衛星星座"
        ],
        [
          "[泰伯早報｜9月21日：北京禁飛區正式啟用；我國突破地下大空間高精度定位導航與控制技術；力箭一號送超智算一號入軌（泰伯網）](https://www.taibo.cn/p/99736)",
          "地理資訊／商業航天垂直媒體轉引吉林一號公眾號內容，覆核「三星編隊、商業天基射頻數據採集」之表述"
        ],
        [
          "[一箭9星背後：通感智算、太空算力，衛星「新品種」密集入軌（財聯社 CLS）](https://www.cls.cn/detail/2488115)",
          "確認發射時間、地點與同箭 9 星名單，並複述「諦聽 01 組 A／B／C 星為我國首次以三星編隊開展商業天基射頻數據採集的衛星星座」"
        ],
        [
          "國際同類系統之公開技術路徑參考",
          "HawkEye 360（TDOA／FDOA 多邊定位原理，作為通用技術框架參考，非對「諦聽」性能之背書）"
        ]
      ],
      "note": "本篇無即時軌道運算、無資料庫查詢，純文字整理案例；數字與技術細節之真確性請以原始新聞來源為準。"
    }
  ]
}
